CVE ID,Description,Base Severity,Confidentiality Impact,Integrity Impact,Availability Impact
CVE-2023-3214,Use after free in Autofill payments in Google Chrome prior to 114.0.5735.133 allowed a remote attacker to potentially exploit heap corruption via a crafted HTML page. (Chromium security severity: Critical),HIGH,HIGH,HIGH,HIGH
CVE-2022-22370,"IBM Security Verify Access 10.0.0.0, 10.0.1.0, 10.0.2.0, and 10.0.3.0 is vulnerable to cross-site scripting. This vulnerability allows users to embed arbitrary JavaScript code in the Web UI thus altering the intended functionality potentially leading to credentials disclosure within a trusted session. IBM X-Force ID: 221194.",MEDIUM,LOW,LOW,NONE
CVE-2022-39036,The file upload function of Agentflow BPM has insufficient filtering for special characters in URLs. An unauthenticated remote attacker can exploit this vulnerability to upload arbitrary file and execute arbitrary code to manipulate system or disrupt service.,CRITICAL,HIGH,HIGH,HIGH
RHSA-2023:3936,important,A flaw was found in the Python package. An issue in the urllib.parse component could allow attackers to bypass blocklisting methods by supplying a URL that starts with blank characters.This may lead to compromised Integrity.,,,
RHSA-2023:3943,moderate,"A broken cryptographic algorithm flaw was found in golang.org/x/crypto/ssh. This issue causes a client to fail authentication with RSA keys to servers that reject signature algorithms based on SHA-2, enabling an attacker to crash the server, resulting in a loss of availability.",,,
